{
  "schema": "migx.song-ontology/1",
  "id": "song-01-deep-intro",
  "ref": "fixtures/synthetic/song-01",
  "source": "local",
  "playback": {
    "mode": "engine_multi_deck",
    "multi_deck_allowed": true
  },
  "duration_beats": 512,
  "bpm": 124.0,
  "key": { "chromatic": "Am", "camelot": "8A", "open_key": "1m" },
  "phrases": { "beats_per_bar": 4, "bars_per_phrase": 8 },
  "sections": [
    { "id": "sec-intro", "type": "intro", "start_beat": 0, "end_beat": 64, "energy": 0.25, "mixable": true,
      "_llm_guidance": "beat-only intro — safe to mix over" },
    { "id": "sec-build", "type": "build", "start_beat": 64, "end_beat": 128, "energy": 0.5 },
    { "id": "sec-drop", "type": "drop", "start_beat": 128, "end_beat": 256, "energy": 0.9,
      "_llm_guidance": "main drop — do not bury with a new element" },
    { "id": "sec-breakdown", "type": "breakdown", "start_beat": 256, "end_beat": 320, "energy": 0.4 },
    { "id": "sec-outro", "type": "outro", "start_beat": 448, "end_beat": 512, "energy": 0.2, "mixable": true }
  ],
  "energy_curve": {
    "unit": "phrase",
    "method": "hand-authored-stub",
    "samples": [0.22, 0.28, 0.45, 0.55, 0.9, 0.88, 0.5, 0.35, 0.25, 0.2]
  }
}
