{
  "schema": "migx.song-ontology/1",
  "id": "song-03-cool-down",
  "ref": "fixtures/synthetic/song-03",
  "source": "local",
  "playback": {
    "mode": "engine_multi_deck",
    "multi_deck_allowed": true
  },
  "duration_beats": 448,
  "bpm": 122.0,
  "key": { "chromatic": "Dm", "camelot": "7A", "open_key": "12m" },
  "phrases": { "beats_per_bar": 4, "bars_per_phrase": 8 },
  "sections": [
    { "id": "sec-intro", "type": "intro", "start_beat": 0, "end_beat": 64, "energy": 0.3, "mixable": true },
    { "id": "sec-build", "type": "build", "start_beat": 64, "end_beat": 128, "energy": 0.45 },
    { "id": "sec-drop", "type": "drop", "start_beat": 128, "end_beat": 256, "energy": 0.7 },
    { "id": "sec-outro", "type": "outro", "start_beat": 352, "end_beat": 448, "energy": 0.25, "mixable": true }
  ],
  "energy_curve": {
    "unit": "phrase",
    "method": "hand-authored-stub",
    "samples": [0.28, 0.35, 0.45, 0.55, 0.7, 0.6, 0.4, 0.3, 0.22]
  }
}
